{
  "figure_count": 59,
  "missing_alt_text": [],
  "missing_data_table_alternative": [],
  "missing_legend_or_colorbar": [],
  "missing_non_color_encoding": [],
  "missing_units_or_axes": [],
  "ok": true,
  "row_count": 59,
  "rows": [
    {
      "alt_text_length": 280,
      "has_alt_text": true,
      "has_data_table_alternative": true,
      "has_legend_or_colorbar": true,
      "has_non_color_encoding": true,
      "has_units_or_axes": true,
      "id": "graphical_abstract_cover",
      "ok": true
    },
    {
      "alt_text_length": 277,
      "has_alt_text": true,
      "has_data_table_alternative": true,
      "has_legend_or_colorbar": true,
      "has_non_color_encoding": true,
      "has_units_or_axes": true,
      "id": "qrf_boundary_screen_geometry",
      "ok": true
    },
    {
      "alt_text_length": 213,
      "has_alt_text": true,
      "has_data_table_alternative": true,
      "has_legend_or_colorbar": true,
      "has_non_color_encoding": true,
      "has_units_or_axes": true,
      "id": "qrf_channel_relabeling_ledger",
      "ok": true
    },
    {
      "alt_text_length": 241,
      "has_alt_text": true,
      "has_data_table_alternative": true,
      "has_legend_or_colorbar": true,
      "has_non_color_encoding": true,
      "has_units_or_axes": true,
      "id": "qrf_invariance_policy_flow",
      "ok": true
    },
    {
      "alt_text_length": 183,
      "has_alt_text": true,
      "has_data_table_alternative": true,
      "has_legend_or_colorbar": true,
      "has_non_color_encoding": true,
      "has_units_or_axes": true,
      "id": "qrf_sectorisation_map",
      "ok": true
    },
    {
      "alt_text_length": 149,
      "has_alt_text": true,
      "has_data_table_alternative": true,
      "has_legend_or_colorbar": true,
      "has_non_color_encoding": true,
      "has_units_or_axes": true,
      "id": "boundary_indistinguishability",
      "ok": true
    },
    {
      "alt_text_length": 144,
      "has_alt_text": true,
      "has_data_table_alternative": true,
      "has_legend_or_colorbar": true,
      "has_non_color_encoding": true,
      "has_units_or_axes": true,
      "id": "qrf_reference_frame_geometry",
      "ok": true
    },
    {
      "alt_text_length": 162,
      "has_alt_text": true,
      "has_data_table_alternative": true,
      "has_legend_or_colorbar": true,
      "has_non_color_encoding": true,
      "has_units_or_axes": true,
      "id": "bmr_free_energy_decomposition",
      "ok": true
    },
    {
      "alt_text_length": 184,
      "has_alt_text": true,
      "has_data_table_alternative": true,
      "has_legend_or_colorbar": true,
      "has_non_color_encoding": true,
      "has_units_or_axes": true,
      "id": "bmr_pruning_phase_diagram",
      "ok": true
    },
    {
      "alt_text_length": 179,
      "has_alt_text": true,
      "has_data_table_alternative": true,
      "has_legend_or_colorbar": true,
      "has_non_color_encoding": true,
      "has_units_or_axes": true,
      "id": "simulation_sensitivity_heatmap",
      "ok": true
    },
    {
      "alt_text_length": 216,
      "has_alt_text": true,
      "has_data_table_alternative": true,
      "has_legend_or_colorbar": true,
      "has_non_color_encoding": true,
      "has_units_or_axes": true,
      "id": "finite_quantum_scope_summary",
      "ok": true
    },
    {
      "alt_text_length": 184,
      "has_alt_text": true,
      "has_data_table_alternative": true,
      "has_legend_or_colorbar": true,
      "has_non_color_encoding": true,
      "has_units_or_axes": true,
      "id": "quantum_boundary_entropy_landscape",
      "ok": true
    },
    {
      "alt_text_length": 171,
      "has_alt_text": true,
      "has_data_table_alternative": true,
      "has_legend_or_colorbar": true,
      "has_non_color_encoding": true,
      "has_units_or_axes": true,
      "id": "quantum_contextuality_witness",
      "ok": true
    },
    {
      "alt_text_length": 240,
      "has_alt_text": true,
      "has_data_table_alternative": true,
      "has_legend_or_colorbar": true,
      "has_non_color_encoding": true,
      "has_units_or_axes": true,
      "id": "quantum_measurement_contextuality_table",
      "ok": true
    },
    {
      "alt_text_length": 232,
      "has_alt_text": true,
      "has_data_table_alternative": true,
      "has_legend_or_colorbar": true,
      "has_non_color_encoding": true,
      "has_units_or_axes": true,
      "id": "quantum_local_polytope_audit",
      "ok": true
    },
    {
      "alt_text_length": 164,
      "has_alt_text": true,
      "has_data_table_alternative": true,
      "has_legend_or_colorbar": true,
      "has_non_color_encoding": true,
      "has_units_or_axes": true,
      "id": "quantum_open_system_dynamics",
      "ok": true
    },
    {
      "alt_text_length": 177,
      "has_alt_text": true,
      "has_data_table_alternative": true,
      "has_legend_or_colorbar": true,
      "has_non_color_encoding": true,
      "has_units_or_axes": true,
      "id": "qfep_boundary_hamiltonian_dynamics",
      "ok": true
    },
    {
      "alt_text_length": 201,
      "has_alt_text": true,
      "has_data_table_alternative": true,
      "has_legend_or_colorbar": true,
      "has_non_color_encoding": true,
      "has_units_or_axes": true,
      "id": "quantum_trajectory_unraveling",
      "ok": true
    },
    {
      "alt_text_length": 202,
      "has_alt_text": true,
      "has_data_table_alternative": true,
      "has_legend_or_colorbar": true,
      "has_non_color_encoding": true,
      "has_units_or_axes": true,
      "id": "many_body_boundary_screen_sweep",
      "ok": true
    },
    {
      "alt_text_length": 189,
      "has_alt_text": true,
      "has_data_table_alternative": true,
      "has_legend_or_colorbar": true,
      "has_non_color_encoding": true,
      "has_units_or_axes": true,
      "id": "sheaf_contextuality_obstruction_audit",
      "ok": true
    },
    {
      "alt_text_length": 173,
      "has_alt_text": true,
      "has_data_table_alternative": true,
      "has_legend_or_colorbar": true,
      "has_non_color_encoding": true,
      "has_units_or_axes": true,
      "id": "qrf_transformation_covariance_audit",
      "ok": true
    },
    {
      "alt_text_length": 189,
      "has_alt_text": true,
      "has_data_table_alternative": true,
      "has_legend_or_colorbar": true,
      "has_non_color_encoding": true,
      "has_units_or_axes": true,
      "id": "empirical_adapter_provenance_audit",
      "ok": true
    },
    {
      "alt_text_length": 216,
      "has_alt_text": true,
      "has_data_table_alternative": true,
      "has_legend_or_colorbar": true,
      "has_non_color_encoding": true,
      "has_units_or_axes": true,
      "id": "arbitrary_two_qubit_entanglement_audit",
      "ok": true
    },
    {
      "alt_text_length": 183,
      "has_alt_text": true,
      "has_data_table_alternative": true,
      "has_legend_or_colorbar": true,
      "has_non_color_encoding": true,
      "has_units_or_axes": true,
      "id": "general_measurement_cover_polytope_audit",
      "ok": true
    },
    {
      "alt_text_length": 193,
      "has_alt_text": true,
      "has_data_table_alternative": true,
      "has_legend_or_colorbar": true,
      "has_non_color_encoding": true,
      "has_units_or_axes": true,
      "id": "thermodynamic_channel_cost_audit",
      "ok": true
    },
    {
      "alt_text_length": 221,
      "has_alt_text": true,
      "has_data_table_alternative": true,
      "has_legend_or_colorbar": true,
      "has_non_color_encoding": true,
      "has_units_or_axes": true,
      "id": "sparse_boundary_screen_scaling_audit",
      "ok": true
    },
    {
      "alt_text_length": 201,
      "has_alt_text": true,
      "has_data_table_alternative": true,
      "has_legend_or_colorbar": true,
      "has_non_color_encoding": true,
      "has_units_or_axes": true,
      "id": "qrf_frame_covariance_toy_audit",
      "ok": true
    },
    {
      "alt_text_length": 223,
      "has_alt_text": true,
      "has_data_table_alternative": true,
      "has_legend_or_colorbar": true,
      "has_non_color_encoding": true,
      "has_units_or_axes": true,
      "id": "quantum_roadmap_readiness_matrix",
      "ok": true
    },
    {
      "alt_text_length": 202,
      "has_alt_text": true,
      "has_data_table_alternative": true,
      "has_legend_or_colorbar": true,
      "has_non_color_encoding": true,
      "has_units_or_axes": true,
      "id": "pymdp_profile_comparison",
      "ok": true
    },
    {
      "alt_text_length": 175,
      "has_alt_text": true,
      "has_data_table_alternative": true,
      "has_legend_or_colorbar": true,
      "has_non_color_encoding": true,
      "has_units_or_axes": true,
      "id": "posterior_trajectory",
      "ok": true
    },
    {
      "alt_text_length": 298,
      "has_alt_text": true,
      "has_data_table_alternative": true,
      "has_legend_or_colorbar": true,
      "has_non_color_encoding": true,
      "has_units_or_axes": true,
      "id": "pymdp_runtime_validation_dashboard",
      "ok": true
    },
    {
      "alt_text_length": 153,
      "has_alt_text": true,
      "has_data_table_alternative": true,
      "has_legend_or_colorbar": true,
      "has_non_color_encoding": true,
      "has_units_or_axes": true,
      "id": "criticality_proxy_panels",
      "ok": true
    },
    {
      "alt_text_length": 226,
      "has_alt_text": true,
      "has_data_table_alternative": true,
      "has_legend_or_colorbar": true,
      "has_non_color_encoding": true,
      "has_units_or_axes": true,
      "id": "criticality_stochastic_ensemble",
      "ok": true
    },
    {
      "alt_text_length": 258,
      "has_alt_text": true,
      "has_data_table_alternative": true,
      "has_legend_or_colorbar": true,
      "has_non_color_encoding": true,
      "has_units_or_axes": true,
      "id": "criticality_signatures",
      "ok": true
    },
    {
      "alt_text_length": 235,
      "has_alt_text": true,